Year;Title;Description;AI Domain;Secondary AI Domain;Subdomain;EU Activity;;;;;;;;;;;;;;;;;;;;
1950;Turing Test;Alan Turing proposes a method of inquiry in artificial intelligence (AI) for determining whether or not a computer is capable of thinking like a human being.;Ethics & Philosophy;;;;;;;;;;;;;;;;;;;;;;;
1950;Computer plays chess ;"Claude Shannon publishes the book ""Programming a Computer for Playing Chess"" that describes how a machine or computer could be made to play a reasonable game of chess.";Reasoning;;Knowledge Representation & Reasoning;;;;;;;;;;;;;;;;;;;;;
1950;Three Laws of Robotics;"Isaac Asimov publishes a set of laws, rules, or principles, which are intended as a fundamental framework to underpin the behavior of robots designed to have a degree of autonomy.The Three Laws of Robotics are: 

1. A robot may not injure a human being or, through inaction, allow a human being to come to harm;
2. A robot must obey the orders given it by human beings except where such orders would conflict with the First Law; and
3. A robot must protect its own existence as long as such protection does not conflict with the First or Second Laws";Ethics & Philosophy;;;;;;;;;;;;;;;;;;;;;;;
1951;Squee;"The Robot Squirrel uses two light sensors and two contact switches to hunt for ”nuts” (actually, tennis balls) and drag them to its nest. Squee was described as “75% reliable,” but it worked well only in a very dark room. Squee was conceived by the computer pioneer Edmund Berkeley, who earlier wrote the hugely popular book ""Giant Brains or Machines That Think"" (1949). The original Squee prototype is in the permanent collection of the Computer History Museum";Integration & Interaction;;Robotics & Automation;;;;;;;;;;;;;;;;;;;;;
1952;Checkers;Checkers was the first program to demonstrate that computers can learn and not only perform what they are programmed to do. Checkers attracted a lot of media attention and learned to play at a level high enough to challenge a decent amateur human player.;Planning;;;;;;;;;;;;;;;;;;;;;;;
1955;Logic Theorist;The Logic Theorist program, written in 1956 by Allen Newell, Herbert Simon and Cliff Shaw, would eventually prove 38 theorems from Whitehead and Russell’s Principia Mathematica. The Logic Theorist introduced several critical concepts to artificial intelligence including heuristics, list processing and ‘reasoning as search.’;Reasoning;;;;;;;;;;;;;;;;;;;;;;;
1956;Dartmouth College AI Conference;The Dartmouth College summer AI conference was organized by John McCarthy, Marvin Minsky, Nathan Rochester of IBM and Claude Shannon. McCarthy coins the term artificial intelligence for the conference.The Darthmouth College AI conference is often refered as the  birthplace of AI. ;Ethics & Philosophy;;;;;;;;;;;;;;;;;;;;;;;
1957;Perceptron;"Frank Rosenblatt's perceptron algorithm is a simplified model of a biological neuron inspired by the human brain. The perceptron was introduced as ""the embryo of an electronic computer that will be able to walk, talk, see, write, reproduce itself and be conscious of its existence."" With the perceptron, connectionism is born, and the foundation of Neural Networks (NN) and Deep Learning ";Learning;;;;;;;;;;;;;;;;;;;;;;;
1958;LISP;John McCarthy invented the Lisp programming language.;Reasoning;;;;;;;;;;;;;;;;;;;;;;;
1958;General Problem Solver (GPS);" The General Problem Solver was the first program that tried to adopt human problem-solving protocols and the ""thinking humanly"" approach. ";Reasoning;;;;;;;;;;;;;;;;;;;;;;;
1959;MIT AI Lab;John McCarthy and Marvin Minsky founded the MIT AI Lab.;Ethics & Philosophy;;;;;;;;;;;;;;;;;;;;;;;
1960;Universal Bayesian methods;Ray Solomonoff lays the foundations of a mathematical theory of AI, introducing universal Bayesian methods for inductive inference and prediction.;Reasoning;;;;;;;;;;;;;;;;;;;;;;;
1961;SAINT;James Slagle writes in Lisp the first symbolic integration program, SAINT, which solved calculus problems at the college freshman level.;Reasoning;;;;;;;;;;;;;;;;;;;;;;;
1961;Unimate;The first industrial robot, Unimate, starts working on an assembly line in a General Motors plant in New Jersey. ;Integration & Interaction;;Robotics & Automation;;;;;;;;;;;;;;;;;;;;;
1963;Rancho Arm;Researchers design the Rancho Arm robot as a tool for the handicapped. The Rancho Arm´s six joints gave it the flexibility of a human arm. Acquired by Stanford University in 1963, it holds a place among the first artificial robotic arms to be controlled by a computer.;Integration & Interaction;;Robotics & Automation;;;;;;;;;;;;;;;;;;;;;
1963;ANALOGY;Thomas Evans' program ANALOGY demonstrated that computers can solve the same analogy problems that are given on IQ tests.;Reasoning;;Knowledge Representation & Reasoning;;;;;;;;;;;;;;;;;;;;;
1963;Beyond simple perceptrons;"Leonard Uhr and Charles Vossler publish  ""A Pattern Recognition Program That Generates, Evaluates, and Adjusts Its Own Operators"", which describes one of the first machine learning programs that could adaptively acquire and modify features and thereby overcome the limitations of Rosenblatt's simple perceptron.";Learning;;Machine Learning;;;;;;;;;;;;;;;;;;;;;
1964;MAC project;Danny Bobrow  shows that computers can understand natural language well enough to solve algebra word problems correctly.;Communication;;Natural Language Processing;;;;;;;;;;;;;;;;;;;;;
1965;Resolution Method;J. Alan Robinson invented a mechanical proof procedure, the Resolution Method, which allowed programs to work efficiently with formal logic as a representation language.;Reasoning;;;;;;;;;;;;;;;;;;;;;;;
1965;ELIZA;ELIZA was a natural language processing system that imitated a doctor. The doctor responded to user questions much like a psychotherapist and was able to make some users believe they were interacting with another human being until it reached its limitations and the conversation became nonsense. DOCTOR used predetermined queries/phrases and used to substitute keywords to mimic humans interacting with the users ;Communication;;Natural Language Processing;;;;;;;;;;;;;;;;;;;;;
1966;ALPAC report;"ALPAC (Automatic Language Processing Advisory Committee) was a committee of seven scientists led by John R. Pierce, established in 1964 by the United States government in order to evaluate the progress in computational linguistics in general and machine translation in particular. Their report, issued in 1966, gained notoriety for being very skeptical of research done in machine translation so far, and emphasizing the need for basic research in computational linguistics; this eventually caused the U.S. government to reduce its funding of the topic dramatically.";Ethics & Philosophy;;;;;;;;;;;;;;;;;;;;;;;
1967;Dendral program;The Dendral program demonstrated to interpret mass spectra on organic chemical compounds. First successful knowledge-based program for scientific reasoning.;Reasoning;;Knowledge Representation & Reasoning;;;;;;;;;;;;;;;;;;;;;
1968;Macsyma;Joel Moses  demonstrated the power of symbolic reasoning for integration problems in the Macsyma program. First successful knowledge-based program in mathematics.;Reasoning;;Knowledge Representation & Reasoning;;;;;;;;;;;;;;;;;;;;;
1968;MacHack;Richard Greenblatt builds a knowledge-based chess-playing program that was good enough to achieve a class-C rating in tournament play.;Planning;;;;;;;;;;;;;;;;;;;;;;;
1969;First IJCAI conference;The International Joint Conference on Artificial Intelligence (IJCAI) was held biennially in odd-numbered years from 1969 to 2015. Starting 2016, IJCAI is held annually.;Ethics & Philosophy;;;;;;;;;;;;;;;;;;;;;;;
1969;Perceptrons;"Marvin Minsky and Seymour Papert publish ""Perceptrons"", demonstrating previously unrecognized limits of this feed-forward two-layered structure. This book is considered to mark the beginning of the AI winter of the 1970s, a failure of confidence and funding for AI.";Learning;;Machine Learning;;;;;;;;;;;;;;;;;;;;;
1969;Frame Problem;"McCarthy and Hayes start the discussion about the frame problem with their essay, ""Some Philosophical Problems from the Standpoint of Artificial Intelligence.""";Ethics & Philosophy;;;;;;;;;;;;;;;;;;;;;;;
1970;Backpropagation;Seppo Linnainmaa publishes the reverse mode of automatic differentiation. This method became later known as backpropagation, and is heavily used to train artificial neural networks.;Learning;;Machine Learning;;;;;;;;;;;;;;;;;;;;;
1970;Natural Language Processing group @ SRI;Jane Robinson and Don Walker establish an influential Natural Language Processing group at SRI.;Communication;;Natural Language Processing;;;;;;;;;;;;;;;;;;;;;
1970;Augmented Transition Network (ATN);Bill Woods describe Augmented Transition Networks (ATN's) as a representation for natural language understanding.;Communication;;Natural Language Processing;;;;;;;;;;;;;;;;;;;;;
1970;Shakey goes AI;The Shakey robot is the first mobile robot controlled by artificial intelligence. Equipped with sensing devices and driven by a problem-solving program called STRIPS, the robot finds its way around the halls of SRI by applying information about its environment to a route. Shakey used a TV camera, laser range finder, and bump sensors to collect data, which it then transmitted to a DEC PDP-10 and PDP-15. The computer sent commands to Shakey over a radio link. Shakey could move at a speed of 2 meters per hour.;Integration & Interaction;;Connected & Automated Vehicles;;;;;;;;;;;;;;;;;;;;;
1971;SHRDLU;Terry Winograd's PhD thesis demonstrates the ability of computers to understand English sentences in a restricted world of children's blocks. He combined the language understanding program, SHRDLU, with a robot arm that carried out instructions typed in English.;Communication;;Natural Language Processing;;;;;;;;;;;;;;;;;;;;;
1972;Prolog;Prolog programming language developed by Alain Colmerauer.;Reasoning;;Knowledge Representation & Reasoning;;;;;;;;;;;;;;;;;;;;;
1973;Freddy Robot;The Assembly Robotics Group at the University of Edinburgh builds Freddy Robot, capable of using visual perception to locate and assemble models. ;Integration & Interaction;;Robotics & Automation;;;;;;;;;;;;;;;;;;;;;
1973;Lighthill report;"James Lighthill reports to the British Science Research Council on the state artificial intelligence research, concluding that ""in no part of the field have discoveries made so far produced the major impact that was then promised,"" leading to drastically reduced government support for AI research.";Ethics & Philosophy;;;;;;;;;;;;;;;;;;;;;;;
1974;MYCIN;Ted Shortliffe's PhD dissertation on the MYCIN program demonstrates a very practical rule-based approach to medical diagnoses, even in the presence of uncertainty. While it borrowed from DENDRAL, its own contributions strongly influenced the future of expert system development, especially commercial systems.;Reasoning;;Knowledge Representation & Reasoning;;;;;;;;;;;;;;;;;;;;;
1974;Silver Arm;David Silver designs the Silver Arm, a robotic arm to do small-parts assembly using feedback from delicate touch and pressure sensors. The arm´s fine movements approximate those of human fingers.;Integration & Interaction;;Robotics & Automation;;;;;;;;;;;;;;;;;;;;;
1974;NOAH;Earl Sacerdoti developed techniques of partial-order planning in his NOAH system, replacing the previous paradigm of search among state space descriptions. NOAH was applied to interactively diagnose and repair electromechanical systems.;Reasoning;;Knowledge Representation & Reasoning;;;;;;;;;;;;;;;;;;;;;
1974;First ECAI Conference;"First edition of the biennial European Conference on Artificial Intelligence (ECAI), who has been runing without interruption since 1974, originally under the name AISB. 
";Ethics & Philosophy;;;;;;;;;;;;;;;;;;;;;;;
1975;Meta-Dendral;The Meta-Dendral learning program produced new results in chemistry (some rules of mass spectrometry) the first scientific discoveries by a computer to be published in a refereed journal.;Reasoning;;Knowledge Representation & Reasoning;;;;;;;;;;;;;;;;;;;;;
1975;Discource and Centering;"Barbara Grosz (SRI) establishes limits to traditional AI approaches to discourse modeling. Subsequent work by Grosz, Bonnie Webber and Candace Sidner developed the notion of ""centering"", used in establishing focus of discourse and anaphoric references in Natural language processing.";Reasoning;;Knowledge Representation & Reasoning;;;;;;;;;;;;;;;;;;;;;
1976;Discovery Model;Douglas Lenat's AM program  demonstrates the discovery model (loosely guided search for interesting conjectures).;Reasoning;;Knowledge Representation & Reasoning;;;;;;;;;;;;;;;;;;;;;
1978;Version Spaces;Tom Mitchell invented the concept of Version spaces for describing the search space of a concept formation program.;Reasoning;;Knowledge Representation & Reasoning;;;;;;;;;;;;;;;;;;;;;
1978;Speak & Spell;Texas Instruments Inc. introduces Speak & Spell, a talking learning aid for children aged 7 and up that is the first electronic duplication of the human vocal tract on a single integrated circuit. Speak & Spell used linear predictive coding to formulate a mathematical model of the human vocal tract and predict a speech sample based on previous input. ;Communication;;Natural Language Processing;;;;;;;;;;;;;;;;;;;;;
1978;Satisficing;"Herbert A. Simon wins the Nobel Prize in Economics for his theory of bounded rationality, one of the cornerstones of AI known as ""satisficing"".";Ethics & Philosophy;;;;;;;;;;;;;;;;;;;;;;;
1979;Stanford Cart;The Stanford Cart was a long-term research project undertaken at Stanford University between 1960 and 1980. In 1979, it successfully crossed a room on its own while navigating around a chair placed as an obstacle. Hans Moravec rebuilt the Stanford Cart in 1977, equipping it with stereo vision. A television camera, mounted on a rail on the top of the cart, took pictures from several different angles and relayed them to a computer.;Integration & Interaction;;Robotics & Automation;;;;;;;;;;;;;;;;;;;;;
1979;EMYCIN;"Bill VanMelle's PhD dissertation demonstrates the generality of MYCIN's representation of knowledge and style of reasoning in his EMYCIN program, the model for many commercial expert system ""shells"".";Reasoning;;Knowledge Representation & Reasoning;;;;;;;;;;;;;;;;;;;;;
1979;INTERNIST;Jack Myers and Harry Pople develop INTERNIST, a knowledge-based medical diagnosis program based on Dr. Myers' clinical knowledge.;Reasoning;;Knowledge Representation & Reasoning;;;;;;;;;;;;;;;;;;;;;
1979;CHI System;Cordell Green, David Barstow, Elaine Kant and others at Stanford demonstrate the CHI system for automatic programming.;Reasoning;;Knowledge Representation & Reasoning;;;;;;;;;;;;;;;;;;;;;
1979;BKG;BKG, a backgammon program written by Hans Berliner, defeats the reigning world champion (in part via luck).;Integration & Interaction;;;;;;;;;;;;;;;;;;;;;;;
1979;Non-monotonic logics & formal aspects of truth maintenance;Drew McDermott and Jon Doyle at MIT, and John McCarthy at Stanford begin publishing work on non-monotonic logics and formal aspects of truth maintenance.;Reasoning;;Knowledge Representation & Reasoning;;;;;;;;;;;;;;;;;;;;;
1979;Neocognitron;"Kunihiko Fukushima's convolutional neural network (""Neocognitron - A Self-organizing Neural Network Model for a Mechanism of Pattern Recognition Unaffected by Shift in Position"")";Learning;;Machine Learning;;;;;;;;;;;;;;;;;;;;;
1980;First AAAI Conference;First National Conference of the American Association for Artificial Intelligence (AAAI);Ethics & Philosophy;;;;;;;;;;;;;;;;;;;;;;;
1980;First ICML Conference;First Machine Learning Workshop, then converted into the International Conference on Machine Learning, taking place in Pittsburgh, US;Ethics & Philosophy;;;;;;;;;;;;;;;;;;;;;;;
1981;First Direct Drive (DD) arm;The first direct drive (DD) arm by Takeo Kanade serves as the prototype for DD arms used in industry today. The electric motors housed inside the joints eliminated the need for the chains or tendons used in earlier robots. DD arms were fast and accurate because they minimize friction and backlash.;Integration & Interaction;;Robotics & Automation;;;;;;;;;;;;;;;;;;;;;
1981;Connection Machine;Danny Hillis designs the connection machine, which utilizes Parallel computing to bring new power to AI, and to computation in general. (Later he establishes the Thinking Machines Corporation);Learning;;Machine Learning;;;;;;;;;;;;;;;;;;;;;
1982;Self-Organized Maps (SOM);Teuvo Kohonen's Self-Organized Maps (SOM) for unsupervised learning are introduced.;Learning;;Machine Learning;;;;;;;;;;;;;;;;;;;;;
1982;Fifth Generation Computer Systems project (FGCS);"The Fifth Generation Computer Systems project (FGCS),  an initiative by Japan's Ministry of International Trade and Industry to create a ""fifth generation computer"" (see history of computing hardware) which was supposed to perform much calculation utilizing massive parallelism.";Services;;AI Services;;;;;;;;;;;;;;;;;;;;;
1983;First CVPR Conference;CVPR was first held in Washington DC in 1983 (previously the conference was named Pattern Recognition and Image Processing).It is currently co-sponsored by the IEEE Computer Society and the Computer Vision Foundation.;Learning;;;;;;;;;;;;;;;;;;;;;;;
1983;Interval Calculus;James F. Allen invents the Interval Calculus, the first widely used formalisation of temporal events.;Reasoning;;Knowledge Representation & Reasoning;;;;;;;;;;;;;;;;;;;;;
1984;First ICRA Conference;The IEEE International Conference on Robotics and Automation (ICRA) was first held in Atlanta, USA. ICRA is an annual academic conference covering advances in robotics. It is one of the premier conferences in its field, alongside the International Conference on Intelligent Robots and Systems (IROS).;Integration & Interaction;;Robotics & Automation;;;;;;;;;;;;;;;;;;;;;
1985;Neural Networks + Backpropagation;Neural Networks become widely used with the Backpropagation algorithm, also known as the reverse mode of automatic differentiation published by Seppo Linnainmaa in 1970 and applied to neural networks by Paul Werbos.;Learning;;Machine Learning;;;;;;;;;;;;;;;;;;;;;
1985;Omnibot 2000;The Omnibot 2000 remote-controlled programmable robot toy could move, talk and carry objects. The cassette player in its chest recorded actions to be taken and speech to be played;Integration & Interaction;;Robotics & Automation;;;;;;;;;;;;;;;;;;;;;
1985;AARON;The autonomous drawing program, AARON, created by Harold Cohen, was demonstrated at the AAAI National Conference (based on more than a decade of work, and with subsequent work showing major developments).;Perception;;Computer Vision;;;;;;;;;;;;;;;;;;;;;
1986;First robot cars;The team of Ernst Dickmanns at Bundeswehr University of Munich builds the first robot cars, driving up to 55 mph on empty streets. ;Integration & Interaction;;Connected & Automated Vehicles;;;;;;;;;;;;;;;;;;;;;
1986;Learning representations by back-propagating errors;David Rumelhart, Geoffrey Hinton, and Ronald Williams publish “Learning representations by back-propagating errors,” in which they describe a new learning procedure, back-propagation, for networks of neuron-like units.;Learning;;Machine Learning;;;;;;;;;;;;;;;;;;;;;
1986;First NeurIPS Conference;The NeurIPS meeting was first proposed in 1986 as NIPS at the annual invitation-only Snowbird Meeting on Neural Networks for Computing organized by The California Institute of Technology and Bell Laboratories. ;Learning;;;;;;;;;;;;;;;;;;;;;;;
1987;The Society of Mind;"Marvin Minsky publishes ""The Society of Mind"", a theoretical description of the mind as a collection of cooperating agents. ";Ethics & Philosophy;;;;;;;;;;;;;;;;;;;;;;;
1987;Nouvelle AI;Rodney Brooks introduces the architecture and behavior-based robotics as a more minimalist modular model of natural intelligence.;Integration & Interaction;;Robotics & Automation;;;;;;;;;;;;;;;;;;;;;
1987;Alacrity 2.0;Commercial launch of generation 2.0 of Alacrity by Alacritous Inc. Allstar Advice Inc. Toronto, the first commercial strategic and managerial advisory system.  The system was based upon a forward-chaining, self-developed expert system with 3,000 rules about the evolution of markets and competitive strategies and co-authored by Alistair Davidson and Mary Chung, founders of the firm with the underlying engine developed by Paul Tarvydas. The Alacrity system also included a small financial expert system that interpreted financial statements and models.;Reasoning;;Knowledge Representation & Reasoning;;;;;;;;;;;;;;;;;;;;;
1988;First IROS Conference;The first IEEE/RSJ International Conference on Intelligent Robots and Systems (IROS) was held in Tokyo, Japan. IROS is an annual academic conference covering advances in robotics, it being one of the premier conferences of its field (alongside ICRA, International Conference on Robotics and Automation).ssions (for example, 790 out of 2459 submitted papers have been accepted for IROS 2011).;Integration & Interaction;;Robotics & Automation;;;;;;;;;;;;;;;;;;;;;
1988;Probabilistic Reasoning in Intelligent Systems;"Judea Pearl publishes ""Probabilistic Reasoning in Intelligent Systems"". His 2011 Turing Award citation reads: “Judea Pearl created the representational and computational foundation for the processing of information under uncertainty. He is credited with the invention of Bayesian networks, a mathematical formalism for defining complex probability models, as well as the principal algorithms used for inference in these models. This work not only revolutionized the field of artificial intelligence but also became an important tool for many other branches of engineering and the natural sciences.”";Reasoning;;Knowledge Representation & Reasoning;;;;;;;;;;;;;;;;;;;;;
1988;A statistical approach to language translation;"Members of the IBM T.J. Watson Research Center publish ""A statistical approach to language translation,"" heralding the shift from rule-based to probabilistic methods of machine translation, and reflecting a broader shift to ""machine learning"" based on statistical analysis of known examples, not comprehension and ""understanding"" of the task at hand (IBM’s project Candide, successfully translating between English and French, was based on 2.2 million pairs of sentences, mostly from the bilingual proceedings of the Canadian parliament).";Communication;;Natural Language Processing;;;;;;;;;;;;;;;;;;;;;
1989;Multi-layer Neural Netwroks + Backpropagation;Yann LeCun and other researchers at AT&T Bell Labs successfully applied a backpropagation algorithm to a multi-layer neural network, recognizing handwritten ZIP codes. Given the hardware limitations at the time, it took about 3 days (still a significant improvement over earlier efforts) to train the network.;Learning;;Machine Learning;;;;;;;;;;;;;;;;;;;;;
1989;ALVINN;Dean Pomerleau had created ALVINN (An Autonomous Land Vehicle in a Neural Network).;Integration & Interaction;;Connected & Automated Vehicles;;;;;;;;;;;;;;;;;;;;;
1989;Deep Thought defeats David Levy;David Levy is the first master chess player to be defeated by a computer. The program Deep Thought defeats Levy who had beaten all other previous computer counterparts since 1968.;Planning;;;;;;;;;;;;;;;;;;;;;;;
1989;Q-learning;"Christopher Watkins publishes his PhD thesis  – ""Learning from Delayed Rewards"" introducing the concept of Q-learning, which greatly improves the practicality and feasibility of reinforcement learning in machines. This new algorithm learned optimal control directly without modelling the transition probabilities or expected rewards of the Markov Decision Process.";Services;;;;;;;;;;;;;;;;;;;;;;;
1990;WWW;At the world’s biggest physics laboratory, CERN in Switzerland, English programmer and physicist Tim Berners-Lee submits two proposals for what will become the Web, starting in March 1989. Neither is approved. He proceeds anyway, with only unofficial support from his boss and his coworker Robert Cailliau. By Christmas of 1990 he has prototyped “WorldWideWeb” (as he writes it) in just three months on an advanced NeXT computer. It features a server, HTML, URLs, and the first browser. That browser also functions as an editor—like a word processor connected to the Internet – which reflects his original vision that the Web should also incorporate authoring and personal organization tools. The idea is that a Web of useful links will grow and deepen as people create them in the course of their daily lives. The Web had been partly inspired by his earlier Enquire program, which had combined networked hypertext with ideas that would later evolve into the Semantic Web;Services;;AI Services;;;;;;;;;;;;;;;;;;;;;
1991;DART;The DART scheduling application deployed in the first Gulf War paid back DARPA's investment of 30 years in AI research.;Reasoning;;Knowledge Representation & Reasoning;;;;;;;;;;;;;;;;;;;;;
1993;Polly;Ian Horswill extends behavior-based robotics by creating Polly, the first robot to navigate using vision and operate at animal-like speeds (1 meter/second).;Integration & Interaction;;Robotics & Automation;;;;;;;;;;;;;;;;;;;;;
1993;Cog;Rodney Brooks, Lynn Andrea Stein and Cynthia Breazeal started the widely publicized MIT Cog project with numerous collaborators, in an attempt to build a humanoid robot child in just five years.;Integration & Interaction;;Robotics & Automation;;;;;;;;;;;;;;;;;;;;;
1993;“very deep learning” task solved;German computer scientist Schmidhuber solves a “very deep learning” task that requires more than 1,000 layers in the recurrent neural network.;Learning;;Machine Learning;;;;;;;;;;;;;;;;;;;;;
